{
    "$schema": "https://json-schema.org/draft/2020-12/schema",
    "$id": "https://github.com/qcif/daff-mito-assembly/blob/main/assets/sample_metadata.schema.json",
    "title": "WF5 per-sample metadata.json",
    "description": "Schema for the C6 (COLLATE) per-sample handoff record — the Taxodactyl handoff artifact, biosecurity audit trail (CONSTITUTION.md rule 16) and input contract for both report tiers (task 42).",
    "type": "object",
    "properties": {
        "$schema": {
            "type": "string",
            "const": "wf5/sample-metadata/v1"
        },
        "sample_id": { "type": "string" },
        "assembly_target": {
            "type": "string",
            "enum": ["animal_mt", "plant_pt", "plant_mt"]
        },
        "kingdom": { "type": "string", "enum": ["animal", "plant"] },
        "organelle": { "type": "string", "enum": ["mt", "pt"] },
        "sample_info": { "type": "string" },
        "sample_type": { "type": "string" },
        "sample_receipt_date": { "type": "string" },
        "storage_location": { "type": "string" },

        "sample_status": {
            "type": "string",
            "description": "Derived status (CONSTITUTION.md principle 7, task 42 §3.1). `invalid_input` (task 61) means the uploaded reads failed the intake integrity check; nothing downstream ran. Never confused with the coverage gate's own `status` field, which is nested under `coverage.gate`.",
            "enum": ["ok", "low_coverage", "no_assembly", "no_barcode", "fail", "invalid_input"]
        },
        "sample_status_reason": { "type": "string" },
        "recovery": {
            "description": "Recovery completeness beside sample_status (task 69). Null for statuses that already say what happened (no_barcode, no_assembly, fail, invalid_input).",
            "type": ["object", "null"],
            "properties": {
                "completeness": {"type": "string", "enum": ["complete", "partial", "unknown"]},
                "reasons": {
                    "type": "array",
                    "items": {"type": "string", "enum": ["target_short", "loci_not_found"]}
                },
                "target_length_bp": {"type": ["integer", "null"]},
                "expected_min_bp": {"type": ["integer", "null"]},
                "expected_max_bp": {"type": ["integer", "null"]},
                "min_fraction": {"type": ["number", "null"]},
                "loci_not_found": {"type": "array", "items": {"type": "string"}},
                "unknown_reason": {"type": ["string", "null"]}
            },
            "required": [
                "completeness", "reasons", "target_length_bp",
                "expected_min_bp", "expected_max_bp", "min_fraction",
                "loci_not_found", "unknown_reason"
            ],
            "additionalProperties": false
        },
        "bundle": {
            "type": "string",
            "enum": ["full", "minimal"]
        },

        "coverage": {
            "type": "object",
            "description": "sample_status.json (gate decision) + coverage.json (estimate/subsampling) + recruit_stats.json (RECRUIT), inlined verbatim.",
            "properties": {
                "gate": { "type": ["object", "null"] },
                "estimate": { "type": ["object", "null"] },
                "recruitment": { "type": ["object", "null"] }
            },
            "required": ["gate", "estimate"]
        },

        "intake": {
            "type": ["object", "null"],
            "description": "intake.json (task 61), inlined verbatim: per-file gzip/FASTQ integrity result from PARSE_SAMPLESHEET.",
            "properties": {
                "status": { "type": "string" },
                "files": { "type": "array" },
                "total_records": { "type": "integer" },
                "dedup_required": { "type": "boolean" },
                "duplicates": {
                    "type": "object",
                    "description": "Task 71: read IDs seen more than once across the sample's input files. `identical` repeats are removed by DEDUPLICATE; `conflicting` repeats (same ID, different record) make the sample invalid. Absent when a structural error stopped the check.",
                    "properties": {
                        "identical": { "type": "integer" },
                        "conflicting": { "type": "integer" },
                        "distinct_ids": { "type": "integer" },
                        "examples": { "type": "array", "items": { "type": "string" } }
                    }
                },
                "conflicts": { "type": "array" },
                "deduplication": {
                    "type": "object",
                    "description": "Task 71: whether DEDUPLICATE ran for this sample, with its record counts. Added by COLLATE.",
                    "properties": {
                        "ran": { "type": "boolean" },
                        "records_in": { "type": "integer" },
                        "records_out": { "type": "integer" },
                        "removed": { "type": "integer" }
                    },
                    "required": ["ran"]
                }
            }
        },

        "read_qc": {
            "type": ["object", "null"],
            "description": "Raw/clean NanoPlot NanoStats.txt (task 43a §4.1), plus a derived filter-yield summary. Null only for `invalid_input` samples, where no QC ran. A missing or malformed NanoStats.txt leaves its section null and sets `unavailable_reason`.",
            "properties": {
                "unavailable_reason": { "type": ["string", "null"] },
                "raw": { "type": ["object", "null"] },
                "clean": { "type": ["object", "null"] },
                "filter_yield": { "type": ["object", "null"] }
            }
        },

        "assembly": {
            "type": ["object", "null"],
            "description": "assembly_info.txt (per-contig stats) + bin_metadata.json (C3 binning decision), inlined.",
            "properties": {
                "contig_count": { "type": ["integer", "null"] },
                "n50": { "type": ["integer", "null"] },
                "total_bp": { "type": ["integer", "null"] },
                "contigs": { "type": "array" },
                "bin_metadata": { "type": ["object", "null"] }
            }
        },

        "rotation": {
            "type": ["object", "null"],
            "description": "ROTATE_TARGET's rotation.json (schema wf5/rotation/v1): whether each circular animal_mt contig was rotated to start at an anchor gene (COX1 first), and why not when it was not. Null when the stage did not run.",
            "properties": {
                "status": { "type": ["string", "null"] },
                "anchors": { "type": "array" },
                "contigs": { "type": "array" }
            }
        },

        "homology": {
            "type": ["object", "null"],
            "description": "Top BLAST hit per target contig (qaccver saccver pident length qcovs evalue bitscore stitle).",
            "properties": {
                "top_hits": { "type": "array" }
            }
        },

        "barcodes": {
            "type": ["object", "null"],
            "description": "Per-locus outcome from validation.tsv.",
            "properties": {
                "loci": { "type": "array" },
                "n_passed": { "type": ["integer", "null"] },
                "n_partial": { "type": ["integer", "null"] }
            }
        },

        "annotation": {
            "type": ["object", "null"],
            "description": "annotation_summary.json, inlined in full (task 42 §5.4) — gene-name-bearing lists additionally carry a canonical form alongside the raw annotator spelling (task 42 §5.3)."
        },

        "provenance": {
            "type": "object",
            "description": "CONSTITUTION.md rule 16 — tool versions, pipeline commit, reference-bundle version, and the full genetic-code candidate list.",
            "properties": {
                "pipeline_commit": { "type": ["string", "null"] },
                "reference_bundle_version": { "type": ["string", "null"] },
                "reference_bundle_generated_at": { "type": ["string", "null"] },
                "tool_versions": { "type": "object" },
                "genetic_code": { "type": ["object", "null"] }
            },
            "required": [
                "pipeline_commit", "reference_bundle_version",
                "tool_versions", "genetic_code"
            ]
        }
    },
    "required": [
        "$schema", "sample_id", "assembly_target", "kingdom", "organelle",
        "sample_status", "sample_status_reason", "bundle",
        "coverage", "provenance"
    ],
    "additionalProperties": false
}
