{
  "$schema": "wf5/sample-metadata/v1",
  "sample_id": "INT-ANIMAL-01",
  "assembly_target": "animal_mt",
  "kingdom": "animal",
  "organelle": "mt",
  "sample_info": "Acyrthosiphon pisum SRR8306868 pre-recruited",
  "sample_type": "intact",
  "sample_receipt_date": "2019-05-02",
  "storage_location": "ENA",
  "sample_status": "ok",
  "sample_status_reason": "clean recovery",
  "bundle": "full",
  "coverage": {
    "gate": {
      "sample_id": "INT-ANIMAL-01",
      "estimated_cov": 327.52,
      "hard_min_required": 10,
      "warn_threshold": 30,
      "below_warn_floor": false,
      "max_allowed": 300,
      "total_recruited_bases": 5567855,
      "nominal_organelle_size": 17000,
      "coverage_basis": "total_recruited",
      "sibling_panels_scored": [],
      "sibling_organelle_fraction": 0.0,
      "status": "ok"
    },
    "estimate": {
      "pre_subsample_cov": 327.52,
      "post_subsample_cov": 294.17,
      "seed": 42,
      "subsampled": true,
      "fraction": 0.916,
      "coverage_basis": "total_recruited"
    },
    "recruitment": {
      "reads_aligned": 889,
      "reads_recruited": 889,
      "min_aligned_frac": 0.0,
      "min_aligned_bp": 0
    }
  },
  "assembly": {
    "contig_count": 10,
    "n50": 20083,
    "total_bp": 215078,
    "contigs": [
      {
        "contig": "contig_5",
        "length": 31241,
        "coverage": 5.0,
        "circular": false
      },
      {
        "contig": "contig_6",
        "length": 28360,
        "coverage": 3.0,
        "circular": false
      },
      {
        "contig": "contig_9",
        "length": 26767,
        "coverage": 5.0,
        "circular": false
      },
      {
        "contig": "contig_8",
        "length": 20574,
        "coverage": 6.0,
        "circular": false
      },
      {
        "contig": "contig_1",
        "length": 20083,
        "coverage": 4.0,
        "circular": false
      },
      {
        "contig": "contig_4",
        "length": 18552,
        "coverage": 4.0,
        "circular": false
      },
      {
        "contig": "contig_2",
        "length": 18424,
        "coverage": 4.0,
        "circular": false
      },
      {
        "contig": "contig_3",
        "length": 17854,
        "coverage": 5.0,
        "circular": false
      },
      {
        "contig": "contig_10",
        "length": 16799,
        "coverage": 123.0,
        "circular": true
      },
      {
        "contig": "contig_7",
        "length": 16424,
        "coverage": 6.0,
        "circular": false
      }
    ],
    "bin_metadata": {
      "sample_id": "INT-ANIMAL-01",
      "assembly_target": "animal_mt",
      "thresholds_applied": {
        "min_identity": 80.0,
        "min_aligned_frac": 0.3,
        "emit": "single",
        "max_contigs": 1,
        "low_coverage_fraction": 0.05,
        "sibling_warn_fraction": 0.3
      },
      "panels_scored": [
        "animal_mt"
      ],
      "sibling_panels_scored": [],
      "n_contigs_total": 10,
      "n_target_selected": 1,
      "contigs_selected": [
        "contig_10"
      ],
      "target_source": "c3_selected_contigs",
      "sibling_carryover": {
        "assembly_bases": 215078,
        "sibling_organelle_bases": 0,
        "sibling_organelle_fraction": 0.0,
        "sibling_warn_fraction": 0.3,
        "sibling_carryover_warning": false
      },
      "contigs": [
        {
          "contig_id": "contig_10",
          "length_bp": 16799,
          "coverage": 123.0,
          "ref_identity_pct": 91.27,
          "aligned_frac": 0.9196,
          "panel_aligned_frac": {
            "animal_mt": 0.9196
          },
          "panel_identity_pct": {
            "animal_mt": 91.27
          },
          "winning_panel": "animal_mt",
          "circular": true,
          "circular_method": "flye_circ",
          "orf_aa_len": 189,
          "selected_genetic_code": 5,
          "low_coverage_candidate": false,
          "classification": "target_candidate"
        },
        {
          "contig_id": "contig_5",
          "length_bp": 31241,
          "coverage": 5.0,
          "ref_identity_pct": 90.28,
          "aligned_frac": 0.0261,
          "panel_aligned_frac": {
            "animal_mt": 0.0261
          },
          "panel_identity_pct": {
            "animal_mt": 90.28
          },
          "winning_panel": "animal_mt",
          "circular": false,
          "circular_method": "none",
          "orf_aa_len": 172,
          "selected_genetic_code": 5,
          "low_coverage_candidate": false,
          "classification": "off_target"
        },
        {
          "contig_id": "contig_6",
          "length_bp": 28360,
          "coverage": 3.0,
          "ref_identity_pct": 88.04,
          "aligned_frac": 0.0246,
          "panel_aligned_frac": {
            "animal_mt": 0.0246
          },
          "panel_identity_pct": {
            "animal_mt": 88.04
          },
          "winning_panel": "animal_mt",
          "circular": false,
          "circular_method": "none",
          "orf_aa_len": 150,
          "selected_genetic_code": 5,
          "low_coverage_candidate": false,
          "classification": "off_target"
        },
        {
          "contig_id": "contig_9",
          "length_bp": 26767,
          "coverage": 5.0,
          "ref_identity_pct": 85.73,
          "aligned_frac": 0.0294,
          "panel_aligned_frac": {
            "animal_mt": 0.0294
          },
          "panel_identity_pct": {
            "animal_mt": 85.73
          },
          "winning_panel": "animal_mt",
          "circular": false,
          "circular_method": "none",
          "orf_aa_len": 354,
          "selected_genetic_code": 5,
          "low_coverage_candidate": false,
          "classification": "off_target"
        },
        {
          "contig_id": "contig_8",
          "length_bp": 20574,
          "coverage": 6.0,
          "ref_identity_pct": 93.3,
          "aligned_frac": 0.1129,
          "panel_aligned_frac": {
            "animal_mt": 0.1129
          },
          "panel_identity_pct": {
            "animal_mt": 93.3
          },
          "winning_panel": "animal_mt",
          "circular": false,
          "circular_method": "none",
          "orf_aa_len": 267,
          "selected_genetic_code": 5,
          "low_coverage_candidate": false,
          "classification": "off_target"
        },
        {
          "contig_id": "contig_1",
          "length_bp": 20083,
          "coverage": 4.0,
          "ref_identity_pct": 70.11,
          "aligned_frac": 0.0791,
          "panel_aligned_frac": {
            "animal_mt": 0.0791
          },
          "panel_identity_pct": {
            "animal_mt": 70.11
          },
          "winning_panel": "animal_mt",
          "circular": false,
          "circular_method": "none",
          "orf_aa_len": 208,
          "selected_genetic_code": 5,
          "low_coverage_candidate": false,
          "classification": "off_target"
        },
        {
          "contig_id": "contig_4",
          "length_bp": 18552,
          "coverage": 4.0,
          "ref_identity_pct": 81.55,
          "aligned_frac": 0.0242,
          "panel_aligned_frac": {
            "animal_mt": 0.0242
          },
          "panel_identity_pct": {
            "animal_mt": 81.55
          },
          "winning_panel": "animal_mt",
          "circular": false,
          "circular_method": "none",
          "orf_aa_len": 232,
          "selected_genetic_code": 5,
          "low_coverage_candidate": false,
          "classification": "off_target"
        },
        {
          "contig_id": "contig_2",
          "length_bp": 18424,
          "coverage": 4.0,
          "ref_identity_pct": 70.21,
          "aligned_frac": 0.0186,
          "panel_aligned_frac": {
            "animal_mt": 0.0186
          },
          "panel_identity_pct": {
            "animal_mt": 70.21
          },
          "winning_panel": "animal_mt",
          "circular": false,
          "circular_method": "none",
          "orf_aa_len": 151,
          "selected_genetic_code": 5,
          "low_coverage_candidate": false,
          "classification": "off_target"
        },
        {
          "contig_id": "contig_3",
          "length_bp": 17854,
          "coverage": 5.0,
          "ref_identity_pct": 74.1,
          "aligned_frac": 0.0604,
          "panel_aligned_frac": {
            "animal_mt": 0.0604
          },
          "panel_identity_pct": {
            "animal_mt": 74.1
          },
          "winning_panel": "animal_mt",
          "circular": false,
          "circular_method": "none",
          "orf_aa_len": 129,
          "selected_genetic_code": 5,
          "low_coverage_candidate": false,
          "classification": "off_target"
        },
        {
          "contig_id": "contig_7",
          "length_bp": 16424,
          "coverage": 6.0,
          "ref_identity_pct": 85.46,
          "aligned_frac": 0.0136,
          "panel_aligned_frac": {
            "animal_mt": 0.0136
          },
          "panel_identity_pct": {
            "animal_mt": 85.46
          },
          "winning_panel": "animal_mt",
          "circular": false,
          "circular_method": "none",
          "orf_aa_len": 176,
          "selected_genetic_code": 5,
          "low_coverage_candidate": false,
          "classification": "off_target"
        }
      ],
      "selected_genetic_code": 5,
      "ref_identity_pct": 91.27,
      "coverage": 123.0,
      "orf_aa_len": 189,
      "circular": true,
      "circular_method": "flye_circ",
      "plastid_canonicalisation": {
        "branch": "not_applicable",
        "reason": "assembly_target=animal_mt"
      }
    }
  },
  "homology": {
    "top_hits": [
      {
        "qaccver": "contig_10",
        "saccver": "NC_011594.1",
        "pident": 98.281,
        "length": 12277,
        "qcovs": 99.0,
        "evalue": 0.0,
        "bitscore": 21311.0,
        "stitle": "Acyrthosiphon pisum mitochondrion, complete genome"
      }
    ]
  },